[
  {
    "id": 39,
    "text": "Anger is the enemy of non-violence and pride is a monster that swallows it up.",
    "author": "",
    "category": "Humility",
    "source": "manual",
    "is_favorite": 0,
    "is_used": 0,
    "usage_count": 0,
    "background_style": "sunrise",
    "text_align": "center",
    "font_size": 30.0,
    "show_author": 1,
    "created_at": "2025-04-18T01:35:47.556811",
    "updated_at": "2025-04-18T01:35:47.556811",
    "uid": "quote-000039"
  }
]
