[
  {
    "id": 45,
    "text": "The first step toward change is awareness. The second step is acceptance.",
    "author": "",
    "category": "Transformation",
    "source": "manual",
    "is_favorite": 0,
    "is_used": 0,
    "usage_count": 0,
    "background_style": "sunrise",
    "text_align": "center",
    "font_size": 30.0,
    "show_author": 1,
    "created_at": "2025-04-18T01:35:47.585292",
    "updated_at": "2025-04-18T01:35:47.585292",
    "uid": "quote-000045"
  }
]
