[
  {
    "id": 3,
    "text": "In silence, we hear the whispers of our soul.",
    "author": "",
    "category": "Self-reflection",
    "source": "manual",
    "is_favorite": 0,
    "is_used": 0,
    "usage_count": 0,
    "background_style": "sunrise",
    "text_align": "center",
    "font_size": 30.0,
    "show_author": 1,
    "created_at": "2025-04-18T01:35:47.368350",
    "updated_at": "2025-04-18T01:35:47.368350",
    "uid": "quote-000003"
  }
]
