[
  {
    "id": 35,
    "text": "Anger is a signal, and one worth listening to.",
    "author": "",
    "category": "Self-awareness",
    "source": "manual",
    "is_favorite": 0,
    "is_used": 1,
    "usage_count": 0,
    "background_style": "sunrise",
    "text_align": "center",
    "font_size": 30.0,
    "show_author": 1,
    "created_at": "2025-04-18T01:35:47.530809",
    "updated_at": "2025-04-18T01:35:47.530809",
    "uid": "quote-000035"
  }
]
