[
  {
    "id": 5,
    "text": "Silence is the true friend that never betrays.",
    "author": "",
    "category": "Trust",
    "source": "manual",
    "is_favorite": 0,
    "is_used": 1,
    "usage_count": 0,
    "background_style": "sunrise",
    "text_align": "center",
    "font_size": 30.0,
    "show_author": 1,
    "created_at": "2025-04-18T01:35:47.379843",
    "updated_at": "2025-04-18T01:35:47.379843",
    "uid": "quote-000005"
  }
]
