[
  {
    "id": 21,
    "text": "Anger is an acid that can do more harm to the vessel in which it is stored than to anything on which it is poured.",
    "author": "",
    "category": "Self-destruction",
    "source": "manual",
    "is_favorite": 0,
    "is_used": 0,
    "usage_count": 0,
    "background_style": "sunrise",
    "text_align": "center",
    "font_size": 30.0,
    "show_author": 1,
    "created_at": "2025-04-18T01:35:47.459833",
    "updated_at": "2025-04-18T01:35:47.459833",
    "uid": "quote-000021"
  }
]
