[
  {
    "id": 14,
    "text": "He who does not understand your silence will not understand your words.",
    "author": "",
    "category": "Understanding",
    "source": "manual",
    "is_favorite": 0,
    "is_used": 0,
    "usage_count": 0,
    "background_style": "sunrise",
    "text_align": "center",
    "font_size": 30.0,
    "show_author": 1,
    "created_at": "2025-04-18T01:35:47.425029",
    "updated_at": "2025-04-18T01:35:47.425029",
    "uid": "quote-000014"
  }
]
