[
  {
    "id": 41,
    "text": "You are what you do, not what you say you’ll do.",
    "author": "",
    "category": "Action",
    "source": "manual",
    "is_favorite": 0,
    "is_used": 0,
    "usage_count": 0,
    "background_style": "sunrise",
    "text_align": "center",
    "font_size": 30.0,
    "show_author": 1,
    "created_at": "2025-04-18T01:35:47.564882",
    "updated_at": "2025-04-18T01:35:47.564882",
    "uid": "quote-000041"
  }
]
