[
  {
    "id": 11,
    "text": "Silence is the language of God; all else is poor translation.",
    "author": "",
    "category": "Spirituality",
    "source": "manual",
    "is_favorite": 0,
    "is_used": 0,
    "usage_count": 0,
    "background_style": "sunrise",
    "text_align": "center",
    "font_size": 30.0,
    "show_author": 1,
    "created_at": "2025-04-18T01:35:47.411489",
    "updated_at": "2025-04-18T01:35:47.411489",
    "uid": "quote-000011"
  }
]
