[
  {
    "id": 12,
    "text": "The strongest reactions are often silent.",
    "author": "",
    "category": "Emotional mastery",
    "source": "manual",
    "is_favorite": 0,
    "is_used": 0,
    "usage_count": 0,
    "background_style": "sunrise",
    "text_align": "center",
    "font_size": 30.0,
    "show_author": 1,
    "created_at": "2025-04-18T01:35:47.414861",
    "updated_at": "2025-04-18T01:35:47.414861",
    "uid": "quote-000012"
  }
]
