[
  {
    "id": 28,
    "text": "Anger doesn’t solve anything. It builds nothing, but it can destroy everything.",
    "author": "",
    "category": "Destruction",
    "source": "manual",
    "is_favorite": 0,
    "is_used": 0,
    "usage_count": 0,
    "background_style": "sunrise",
    "text_align": "center",
    "font_size": 30.0,
    "show_author": 1,
    "created_at": "2025-04-18T01:35:47.493529",
    "updated_at": "2025-04-18T01:35:47.493529",
    "uid": "quote-000028"
  }
]
