[
  {
    "id": 38,
    "text": "Do not let your anger become a prison.",
    "author": "",
    "category": "Freedom",
    "source": "manual",
    "is_favorite": 0,
    "is_used": 0,
    "usage_count": 0,
    "background_style": "sunrise",
    "text_align": "center",
    "font_size": 30.0,
    "show_author": 1,
    "created_at": "2025-04-18T01:35:47.552057",
    "updated_at": "2025-04-18T01:35:47.552057",
    "uid": "quote-000038"
  }
]
