[
  {
    "id": 15,
    "text": "Silence is the best answer to someone who doesn’t value your words.",
    "author": "",
    "category": "Self-respect",
    "source": "manual",
    "is_favorite": 0,
    "is_used": 0,
    "usage_count": 0,
    "background_style": "sunrise",
    "text_align": "center",
    "font_size": 30.0,
    "show_author": 1,
    "created_at": "2025-04-18T01:35:47.429622",
    "updated_at": "2025-04-18T01:35:47.429622",
    "uid": "quote-000015"
  }
]
