[
  {
    "id": 24,
    "text": "Anger is just anger. It isn’t good. It isn’t bad. It just is. What you do with it is what matters.",
    "author": "",
    "category": "Control",
    "source": "manual",
    "is_favorite": 0,
    "is_used": 0,
    "usage_count": 0,
    "background_style": "sunrise",
    "text_align": "center",
    "font_size": 30.0,
    "show_author": 1,
    "created_at": "2025-04-18T01:35:47.475942",
    "updated_at": "2025-04-18T01:35:47.475942",
    "uid": "quote-000024"
  }
]
