[
  {
    "id": 23,
    "text": "Holding onto anger is like drinking poison and expecting the other person to die.",
    "author": "",
    "category": "Letting go",
    "source": "manual",
    "is_favorite": 0,
    "is_used": 0,
    "usage_count": 0,
    "background_style": "sunrise",
    "text_align": "center",
    "font_size": 30.0,
    "show_author": 1,
    "created_at": "2025-04-18T01:35:47.470983",
    "updated_at": "2025-04-18T01:35:47.470983",
    "uid": "quote-000023"
  }
]
